### ISSUE TITLE
pgbouncer 1.17.0-10 - issue with auth_query: function not found

### ISSUE THREAD

**Issue by npmichaly** [pgbouncer/pgbouncer#760]
Hi,
I am facing a strange issue with pgbouncer using the auth_query. Whenever the lookup function is called by the pgbouncer session, the function seems not to be accessible.

**Test case:**
Executing a psql login with application user _appuser_.
Credentials should checked by the auth_query using _postgres_ superuser on the target database.
pgbouncer and database are running on the same host:

```shell
/u00/app/pgsql/test/data [pgd11B]$ psql --host=localhost--port=6432 -U appuser -d apptest
psql: FATAL:  bouncer config error
Error Log:
 [23782] HINT:  No function matches the given name and argument types. You might need to add explicit type casts.
 [23782] STATEMENT:  SELECT p_user, p_password FROM public.lookup($1)
```

Login directly on the database, with _postgres_ and executing the same auth_query works:
```shell
/u00/app/pgsql/test/data [pgd11B]$ psql --host=localhost--port=5433 -U postgres
psql (11.17)
Type "help" for help.

postgres=# SELECT p_user, p_password FROM public.lookup('appuser');
 p_user  |             p_password
---------+-------------------------------------
 appuser | md5***********************************
```
Function accessible:
```shell
/u00/app/pgsql/test/data [pgd11B]$ psql --host=localhost --port=5433 -U postgres
psql (11.17)
Type "help" for help.

postgres=# \df+
                                                                                                                List of functions
 Schema |  Name  | Result data type |          Argument data types           | Type | Volatility | Parallel |  Owner   | Security |  Access privileges   | Language |                         Source code                          | Description
--------+--------+------------------+----------------------------------------+------+------------+----------+----------+----------+----------------------+----------+--------------------------------------------------------------+-------------
 public | lookup | record           | INOUT p_user name, OUT p_password text | func | volatile   | unsafe   | postgres | definer  | postgres=X/postgres +| sql      | SELECT usename, passwd FROM pg_shadow WHERE usename = p_user |
        |        |                  |                                        |      |            |          |          |          | pgbouncer=X/postgres |          |                                                              |
(1 row)

postgres=#
```

Using the sql query "SELECT usename, passwd FROM pg_shadow WHERE usename=$1" instead of the function works.

**Setup:**
```shell
$ pgbouncer --version
PgBouncer 1.17.0
libevent 2.0.21-stable
adns: evdns2
tls: OpenSSL 1.0.2k-fips  26 Jan 2017

pgsql/test/data [pgd11B]$ psql --version
psql (PostgreSQL) 11.17
```

**1. pgbouncer.ini**
```ini
[databases]
apptest = host=localhost port=5433 auth_user=postgres dbname=apptest
[pgbouncer]
logfile = /var/log/pgbouncer/pgbouncer.log
pidfile = /var/run/pgbouncer/pgbouncer.pid

listen_addr = 127.0.0.1
listen_port = 6432

auth_type = md5
auth_file = /etc/pgbouncer/userlist.txt
auth_query = SELECT p_user, p_password FROM public.lookup($1)
#auth_query = SELECT usename, passwd FROM pg_shadow WHERE usename=$1

admin_users = postgres
stats_users = stats, postgres
```
**2. userlist.txt**
```
"postgres" "md5**************"
```
**3. pg_hba.conf**
```
local   replication     all                                     trust
host    replication     all             127.0.0.1/32            trust
host    replication     all             ::1/128                 trust
host    all             pgbouncer       127.0.0.1/32            md5
host    all             postgres        127.0.0.1/32            md5
host    apptest         appuser         127.0.0.1/32            md5
```
**4. tcpdump**
**Login credentials ok:**
E..P..@.@............P.9.+.D.Q..P..V.D.....(....**database.apptest.user.postgres..**
13:35:54.713435 IP localhost.pyrrho > localhost.53584: Flags [.], ack 41, win 342, length 0
E..(.3@.@............9.P.Q...+.lP..V....
13:35:54.716299 IP localhost.pyrrho > localhost.53584: Flags [P.], seq 1:329, ack 41, win 342, length 328
E..p.4@.@..Q.........9.P.Q...+.lP..V.d..R........S....application_name..S....client_encoding.UTF8.S....DateStyle.ISO, 
**Superuser**
MDY.S....integer_datetimes.on.S....IntervalStyle.postgres.S....**is_superuser.on.S**....server_encoding.UTF8.S....server_version.11.17.S...#session_authorization.postgres.S...#standard_conforming_strings.on.S....TimeZone.Europe/Berlin.K...........]Z....I
13:35:54.716302 IP localhost.53584 > localhost.pyrrho: Flags [.], ack 329, win 350, length 0
E..(..@.@............P.9.+.l.Q..P..^....
13:35:54.716382 IP localhost.53584 > localhost.pyrrho: Flags [P.], seq 41:75, ack 329, win 350, length 34
E..J..@.@............P.9.+.l.Q..P..^.>..Q...!SET application_name='psql';.
13:35:54.716522 IP localhost.pyrrho > localhost.53584: Flags [P.], seq 329:371, ack 75, win 342, length 42
E..R.5@.@..n.........9.P.Q...+..P..V.F..S....application_name.psql.C....SET.Z....I
13:35:54.716544 IP localhost.53584 > localhost.pyrrho: Flags [P.], seq 75:178, ack 371, win 350, length 103
**Bind variable passed correctly**
E.....@.@............P.9.+...Q.=P..^....P...8.SELECT p_user, p_password FROM public.lookup($1)...B.............**.appuser.**.D....P.E...    .....S....
13:35:54.716847 IP localhost.pyrrho > localhost.53584: Flags [P.], seq 371:587, ack 178, win 342, length 216
**Function does not exist?**
E....6@.@............9.P.Q.=.+..P..V....E....SERROR.VERROR.C42883.M**function public.lookup(unknown) does not exist**.HNo function matches the given name and argument types. You might need to add explicit type casts..P32.Fparse_func.c.L621.RParseFuncOrColumn..

Any idea on this?

**Comment by goksgie** [comment]
I am not really experienced on PostgreSQL but this might be looking like a search path issue. Can you check if you can execute the following on the target database:

```
psql --host=localhost--port=5433 -U postgres -d apptest

postgres=# SELECT p_user, p_password FROM public.lookup('appuser');
```
There is an effort to make specifying an authentication database possible which should eventually help avoiding porting functions to all databases.
